,text1,text2
0,"Hong Kong, with a population of around 7.5 million, had a total of 6,039 cases and 108 deaths as of Saturday, a low rate for any city. But the region’s recent setbacks underscore the challenges that the world will continue to face until there is a widely available vaccine . As cases have soared back to alarming levels in recent weeks, South Korea, Japan and Hong Kong have had to quickly recalibrate their strategies. Travel bubbles that were announced with great fanfare are now on hold. Weeks after reopening, schools have been shut again. Bars and restaurants are closing early or shifting to takeaway menus. “We need solidarity in this kind of situation, but as everyone knows, it’s not easy,” said Dr. Kim Woo-joo, an infectious disease specialist at Korea University in Seoul .","Governors and health officials tell us that there is a profound gap between the protective equipment, hospital equipment and testing resources that are needed (and will be needed) and what is available (or in the pipeline). Bill Gates reminds us that we will need to produce millions, perhaps billions, of doses of vaccine [https://www.washingtonpost.com/opinions/bill-gates-heres-how-to-make-up-for-lost-time-on-covid-19/2020/03/31/ab5c3cf2-738c-11ea-85cb-8670579b863d_story.html] in 12 to 18 months. This isn’t a passing crisis; we will need more of everything in two months, six months and maybe years. Don’t let debate over the details of General Motors ’ and Ventec’s honorable effort to build more ventilators[https://www.nytimes.com/2020/03/30/business/gm-ventilators-coronavirus-trump.html] hide the bottom line: The federal government has all the authority it needs to close the supply gap, allocate resources among states, and prepare for the production and distribution of the vaccine to come. Until the federal government demonstrates — with statistics, contracts and timelines — that the gap is closed and the vaccine pipeline is ready, we should ask: Why isn’t the government bringing its full arsenal to the fight? The D.P.A.’s authorities[https://fas.org/sgp/crs/natsec/IN11231.pdf] go beyond prioritizing contracts and manufacturing supplies. Its allocation authority addresses the problem of states’ competing against one another for scarce resources based on market mechanisms. The federal government can allocate equipment and supplies based on actual need and best public-health practices. The D.P.A.’s industry assessment authority can be used to measure production and distribution capacity, remove blind spots, plan efficiently and recreate a supply chain at home. The federal government can determine now which entities could produce vaccines while it plans for their ethical allocation. The government can then use the D.P.A.’s Title III incentive authorities to issue loans, offer antitrust protection and guarantee purchases, creating a secure market for masks, tests and vaccines . The law is so broad in places that it is sometimes referred to as a “commandeering” authority. Lawyers prefer to say the president would act at the zenith of his authority under the paradigm presented in Justice Jackson’s concurrence[https://www.law.cornell.edu/supremecourt/text/343/579] in the Supreme Court’s landmark Youngstown[https://supreme.justia.com/cases/federal/us/343/579/] https://supreme.justia.com/cases/federal/us/343/579/[https://supreme.justia.com/cases/federal/us/343/579/] case[https://supreme.justia.com/cases/federal/us/343/579/]. But its use is not as extraordinary as some suggest, and it is not commandeering. The Defense Department alone uses the prioritization authority some 300,000 times a year, while the government uses Title III incentives 20 to 30 times per year. Although the allocation authority has not been used since the Cold War[https://www.fema.gov/media-library-data/1582898704576-dc44bbe61cce3cf763cc8a6b92617188/2018_DPAC_Report_to_Congress.pdf], some civilian airliners and freighters remain allocated for the Civil Reserve Air Fleet. Nor does exercise of the prioritization and allocation authority equate to state ownership. Under the act, corporations are paid fair market value for their products. Any actual “commandeering” of production would require just compensation under the Fifth Amendment’s Takings Clause. Moreover, price controls under the D.P.A. require a joint resolution of Congress signed into law by the president. The D.P.A. also contains built-in safeguards. A majority of its provisions expire every five years. That is why it has been reauthorized by Congress over 50 times[https://crsreports.congress.gov/product/pdf/R/R43767#page=6] since its passage in 1950. Congress can decline to do so or do so with amendments when the act comes up for reauthorization in 2025, or sooner. The law also gives federal courts jurisdiction over disputes including the power to determine and award fair market value and forbid the executive branch from using the statute improperly. If a business feels the government is overreaching or unrealistic in its timelines, it can seek relief in court and do so on an emergency basis. Finally, the government reports annually on the D.P.A.’s use: Not only will the Congress know how the act is used, the public will, too. What about liability? The first answer is to make equipment that works. The second answer is Title 42, giving the secretary of health and human services authority to determine that the coronavirus pandemic “constitutes a public health emergency[https://uscode.house.gov/view.xhtml?req=(title:42%20section:247d-6d%20edition:prelim)],” recommend use of “covered countermeasures” to fight the pandemic and in doing so grant broad protection from liability under both state and federal law, except in the case of “willful misconduct.” There are other solutions as well, like special legislation, indemnification clauses to contracts, the government contract defense and, if all else fails, waivers. Here’s the big picture: In times of crisis, when lives are at stake, lawyers and policymakers are supposed to find solutions to problems — to get to yes with honor and within the law — and not to create obstacles. State and local authorities are imploring the federal government to use the authority it has to secure our medical supply chain. So far, the administration appears to have responded like a parent doling out candy to a child: one piece at a time. This is an “all hands on deck” moment, not merely to flatten the curve but to leap ahead of the curve. America was once the arsenal of democracy; the D.P.A. can help make us the arsenal of public health. If I were advising the president (or the secretaries with delegated authority), I would say this: Please, tell the public what the need is and how the need will be met today, next week and in the months to come. What specifically has been contracted for, in how many units and on what timeline? Where there is a gap between need and supply, use the D.P.A. to close it. I’ve never heard of a commander who complained about having too many tanks or who asked for a few artillery shells and not one too many. It’s high time we fought the virus the American way: with everything we’ve got. James E. Baker, the director of Syracuse University’s Institute for Security Policy and Law, is a former Marine infantry officer, legal adviser to the National Security Council and chief judge of the U.S. Court of Appeals for the Armed Forces. The Times is committed to publishing a diversity of letters[https://www.nytimes.com/2019/01/31/opinion/letters/letters-to-editor-new-york-times-women.html] to the editor. We’d like to hear what you think about this or any of our articles. Here are some tips[https://help.nytimes.com/hc/en-us/articles/115014925288-How-to-submit-a-letter-to-the-editor]. And here’s our email: letters@nytimes.com[mailto:letters@nytimes.com]. Follow The New York Times Opinion section on Facebook[https://www.facebook.com/nytopinion], Twitter (@NYTopinion), Twitter (@NYTopinion)[http://twitter.com/NYTOpinion] and Instagram[https://www.instagram.com/nytopinion/]."
1,"Social distancing restrictions meant some senators, Fauci and other witnesses participated by video conference from their homes and officers. Several senators attended the Washington hearing in person, but GOP Sen. Lamar Alexander led the meeting from his home in Tennessee. Here are six key points from the hearing: Fauci: Ignoring guidelines may lead to 'suffering and death' Fauci said not following federal guidelines such as testing people for infection, tracing their contacts and isolating them to prevent the disease from spreading could lead to some suffering and death” that could be avoided. Guidelines to states include waiting until cases have declined for at least two weeks before easing restrictions. Communities also have to be capable of adequately responding when the virus inevitably returns, he said. HEROES Act: Democrats' $3 trillion coronavirus stimulus proposal includes more $1,200 checks, money for state and local governments But Fauci warned that if states reopen without precautions, it presents a “real risk that you will trigger an outbreak,” which could hurt the economy again. “You can almost turn the clock back, rather than going forward,” he said. “That is my main concern.” Fauci on coronavirus : 'We don’t have it completely under control' Despite declines in infections and hospitalizations in some areas, Fauci warned about spikes and said the virus is nowhere near being contained. “We don’t have it completely under control,” he told Sen. Elizabeth Warren, D-Mass. Sen. Chris Murphy, D-Conn., criticized the contrast between health experts warning about the dangers of opening states too early mere hours after Trump said the country prevailed against the virus. “This is infuriating to many of us because it comes hours after the president declared that we have prevailed over coronavirus , which I’m just going to tell you is going to make it harder on state leaders to keep social distancing restrictions in place,” he said. Trump promoted the country’s testing Monday in a Rose Garden news conference, saying the 9 million tests so far made America a worldwide leader. “We have met the moment, and we have prevailed,” said Trump, who later said he meant the country prevailed on testing. Trump going to PA: Donald Trump to visit Allentown, Pennsylvania factory as he pushes message on reopening Murphy also slammed the lack of detailed federal guidance as states begin to reopen. Robert Redfield, head of the Centers for Disease Control and Prevention , said state officials could contact his agency with their questions. He said nationwide recommendations are under review and would be released soon. Murphy said soon wasn't good enough. “You work for a president who is frankly undermining our efforts to comply with the guidance that you have given us,” Murphy said. “Then the guidance you have provided is criminally vague.” Fauci: Finding a vaccine 'definitely not a long shot' Fauci expressed optimism Tuesday that a vaccine will be found for the coronavirus within a year or two. His confidence stemmed from the fact that most people can fight off the virus themselves, offering scientists an opportunity to devise a way to get the body to combat it better. “It’s definitely not a long shot,” Fauci said.","Everything seems normal. And yet nothing is. I live in the same house as Carlota, a wonderful, loving and brilliant 9-year-old girl, and the daughter of Chiquinquirá Delgado, my partner. Carlota brought happiness into my life from the moment I met her, just a few months after her birth, and I couldn’t imagine this house without her in it. “Good morning everyone!” she shouts from her bedroom when she wakes up. Her tireless energy — she loves to create dance moves — and curiosity has made the tedium of quarantine a bit easier to endure. Carlota — like the roughly half of the world’s population[https://www.nytimes.com/2020/04/03/world/coronavirus-news-updates.html?action=click =Spotlight =Homepage] living in coronavirus -induced lockdown — has been stuck at home for several weeks now, and there are times when her sadness and frustration rise to the surface. Like when she wonders, with tears in her eyes, if we’ll still be able to throw her a birthday party in May. Or when she wants to get together with her friends and doesn’t quite understand why they can’t come over. One of our biggest achievements as parents during the crisis was taking Carlota on a short bike ride with one of her friends. The kids enjoyed it, but saying goodbye without touching was really hard for them. The truth, however, is that Carlota’s generation — there are an estimated 74 million children under 17[https://www.childstats.gov/americaschildren/tables/pop1.asp] in the United States — is much better prepared than ours to face months of isolation. These young people have been unintentionally training for this moment all their lives. From a very young age, they’ve been communicating with one another using devices that never existed in my time. So when we told them they couldn’t leave the house, all they did was enter “virtual mode.” Faced with adversity due to an uncooperative virus, Carlota has reproduced her old social world in her bedroom, with all her games, music and friends within easy reach; even her classroom is there. She often has three screens going simultaneously: the TV (where she’s watching a movie or a series), her smartphone (where she’s talking with friends on FaceTime) and her iPad. With all her devices, Carlota has created a digital geography that would be impossible for me to navigate. She’s lucky that the internet is working so well in the Miami area where we live. If we were somewhere else, like Brownsville, Texas[https://www.nytimes.com/2020/03/27/business/economy/coronavirus-inequality.html], for example, the connection might not be so stable. For weeks now, Carlota has been building an imaginary digital house using the simulation game Bloxburg, making videos based on Billie Eilish’s music on TikTok (her account is private; only her friends have access) and drawing amazing works of art with the Procreate app. This cyberswarm is the center of Carlota’s new life. For her and her friends, almost everything is temporary and disposable. “That’s so 2019,” she tells me when I ask her about apps and platforms she no longer uses. The virus, however, is still here. These days, Carlota has new fears. Her once quiet and predictable nights, which always included 20 minutes of reading, have become chaotic and irregular, almost like a teenager’s. Noises she once ignored now awaken her. Each night, she tries to soothe her anxieties with a different plush toy. She knows each toy’s name by heart and where it came from. The ritual of choosing the “plush of the night” is worthy of a reality show, with jubilant winners and vanquished losers. As a family, we’ve established fixed mealtimes, with no electronic devices, and we try not to talk about the coronavirus when Carlota is present. But we don’t change the subject if she brings it up, and we try to answer all her questions as best we can. The virus haunts all of us, keeping us awake at night. It’s everywhere — on the door handles we touch, the packages that show up at our door, the phone conversations we have with friends and family, and in the new rules that keep us locked inside. Carlota is unlikely to return to school to finish the fourth grade. I hear the school year may be extended a couple of weeks into the summer. I hope it will. Regardless, teaching our children effectively during a health crisis like this will require extraordinary endurance and creativity. Everything indicates that, even in the best-case scenario, we won’t have a vaccine until 2021. The children of the 2020 pandemic have a lot to teach us. They adapt quickly to new situations and use technology with astonishing proficiency: Carlota and her friends can Google a solution to nearly any problem. I want to believe that if they were the ones in charge, they wouldn’t have wasted weeks — like our current leaders did — in confronting the coronavirus . In the future, I hope Carlota’s generation puts the interests of science and health above those of politics and prejudice. Whether she knows it or not, Carlota is already a survivor, and she’s better prepared than I am to face the crisis ahead. I envy the strength and resilience of both her lungs and her attitude toward life. I’m pretty sure that Carlota has the numbers of more close friends saved in her phone than I do. But, at least for now, she can’t play with them as I did with mine when I was her age. And I fear that social distancing will become an unhealthy habit for Carlota and her peers. No talking face to face, no hugging or kissing. They’re missing the sweetest things about being human. I can barely make out half of Carlota’s back through the semi-open door of her room, but she sees me before I can walk away. “¡Te quiero mucho!” I tell her in Spanish. “I love you too!” she responds, with a giant smile. And somehow the two of us, with heavy hearts, resist the urge to hug each other. Jorge Ramos (@jorgeramosnews[https://twitter.com/jorgeramosnews]) is an anchor for the Univision network, a contributing opinion writer and the author of, most recently, “Stranger: The Challenge of a Latino Immigrant in the Trump Era.” The Times is committed to publishing a diversity of letters[https://www.nytimes.com/2019/01/31/opinion/letters/letters-to-editor-new-york-times-women.html] to the editor. We’d like to hear what you think about this or any of our articles. Here are some tips[https://help.nytimes.com/hc/en-us/articles/115014925288-How-to-submit-a-letter-to-the-editor]. And here’s our email: letters@nytimes.com[mailto:letters@nytimes.com]. Follow The New York Times Opinion section on Facebook[https://www.facebook.com/nytopinion], Twitter (@NYTopinion), Twitter (@NYTopinion)[http://twitter.com/NYTOpinion] and Instagram[https://www.instagram.com/nytopinion/]."
